{
  "$schema": "./design-tokens.schema.json",
  "version": "1.1.0",
  "metadata": {
    "lastUpdated": "2026-03-10T00:00:00.000Z",
    "author": "diBoaS Platform Team",
    "description": "Core design token subset (schema-validated). The canonical source of truth is design-tokens.css which is manually maintained and contains the full token set."
  },
  "brand": {
    "logo": "#02c3cf",
    "primary": "#14b8a6",
    "primaryDark": "#0d9488"
  },
  "social": {
    "whatsapp": "#25D366",
    "twitter": "#000000",
    "instagram": "#E4405F",
    "linkedin": "#0A66C2",
    "facebook": "#1877F2",
    "telegram": "#0088cc",
    "copy": "#64748b",
    "download": "#0d9488"
  },
  "typography": {
    "title": {
      "hero": {
        "desktop": 48,
        "mobile": 34
      },
      "section": {
        "desktop": 40,
        "mobile": 30
      }
    },
    "body": {
      "subtitle": 16,
      "description": 16
    },
    "ui": {
      "link": 14,
      "button": 12
    }
  },
  "spacing": {
    "section": {
      "desktop": {
        "y": 64,
        "x": 120
      },
      "tablet": {
        "y": 48,
        "x": 64
      },
      "mobile": {
        "y": 48,
        "x": 24
      }
    },
    "container": {
      "padding": "1rem"
    },
    "card": {
      "padding": "1.5rem"
    }
  },
  "layout": {
    "navigation": {
      "desktopHeight": "80px",
      "mobileNavHeight": "60px",
      "dropdownHeight": "60vh",
      "mobileSubmenuHeight": {
        "mobile": "65vh",
        "tablet": "42vh"
      }
    },
    "spacing": {
      "dropdownMarginLeft": "150px"
    }
  },
  "animation": {
    "duration": {
      "fast": "0.15s",
      "normal": "0.3s",
      "slow": "0.6s"
    },
    "easing": {
      "easeOut": "cubic-bezier(0.16, 1, 0.3, 1)",
      "easeInOut": "cubic-bezier(0.4, 0, 0.2, 1)",
      "bounce": "cubic-bezier(0.68, -0.55, 0.265, 1.55)"
    }
  },
  "zIndex": {
    "dropdown": 40,
    "mobileMenu": 50,
    "modal": 60,
    "toast": 70
  },
  "breakpoints": {
    "sm": "640px",
    "md": "768px",
    "lg": "1024px",
    "xl": "1280px",
    "xxl": "1536px"
  },
  "components": {
    "cta": {
      "button": {
        "primary": {
          "variant": "gradient",
          "size": "lg"
        },
        "secondary": {
          "variant": "outline",
          "size": "default"
        },
        "subtle": {
          "variant": "link",
          "size": "default"
        }
      },
      "link": {
        "target": "_blank",
        "rel": "noopener noreferrer"
      }
    }
  }
}
